{
  "$schema": "https://json-schema.org/draft/2020-12/schema",
  "$id": "fixture://schemas/companion-contract.json",
  "type": "object",
  "additionalProperties": false,
  "required": [
    "schema_version",
    "artifact_id",
    "artifact_type",
    "constitution_id",
    "version",
    "summary",
    "requirements",
    "cannot_claim"
  ],
  "properties": {
    "schema_version": {
      "const": "1.0.0"
    },
    "artifact_id": {
      "type": "string",
      "minLength": 1
    },
    "artifact_type": {
      "type": "string",
      "minLength": 1
    },
    "constitution_id": {
      "type": "string",
      "minLength": 1
    },
    "version": {
      "type": "string",
      "minLength": 1
    },
    "summary": {
      "type": "string",
      "minLength": 1
    },
    "requirements": {
      "type": "array",
      "minItems": 1,
      "items": {
        "type": "string",
        "minLength": 1
      },
      "uniqueItems": true
    },
    "cannot_claim": {
      "type": "array",
      "items": {
        "type": "string",
        "minLength": 1
      },
      "uniqueItems": true
    }
  }
}
